{
  "$schema": "http://json-schema.org/draft-07/schema#",
  "title": "studio/meta.json",
  "description": "What the project is: its languages, its size and the stages of the check that ran.",
  "x-artifact": "studio/meta.json",
  "x-owner": "NS36",
  "type": "object",
  "required": [
    "schema_version",
    "contract",
    "languages",
    "files",
    "lines",
    "stages"
  ],
  "properties": {
    "schema_version": {
      "const": 1
    },
    "contract": {
      "const": 1
    },
    "languages": {
      "type": "array",
      "items": {
        "type": "object",
        "required": [
          "name",
          "files",
          "share"
        ],
        "properties": {
          "name": {
            "type": "string"
          },
          "files": {
            "type": "integer",
            "minimum": 0
          },
          "share": {
            "$ref": "#/$defs/ratio"
          }
        }
      }
    },
    "files": {
      "$ref": "#/$defs/measure"
    },
    "lines": {
      "$ref": "#/$defs/measure"
    },
    "stages": {
      "type": "array",
      "items": {
        "type": "object",
        "required": [
          "id",
          "title",
          "state"
        ],
        "properties": {
          "id": {
            "type": "string"
          },
          "title": {
            "type": "string"
          },
          "state": {
            "type": "string",
            "enum": [
              "done",
              "partial",
              "skipped",
              "failed"
            ]
          }
        }
      }
    }
  },
  "$defs": {
    "ratio": {
      "type": "number",
      "minimum": 0,
      "maximum": 1
    },
    "source": {
      "type": "string",
      "minLength": 1,
      "description": "file#field, or the formula, the number comes from"
    },
    "measure": {
      "type": "object",
      "required": [
        "value",
        "src"
      ],
      "properties": {
        "value": {
          "type": [
            "number",
            "null"
          ],
          "minimum": 0
        },
        "src": {
          "$ref": "#/$defs/source"
        },
        "unit": {
          "type": "string",
          "enum": [
            "count",
            "seconds",
            "bytes",
            "lines"
          ]
        }
      }
    },
    "ratio_measure": {
      "type": "object",
      "required": [
        "value",
        "src"
      ],
      "properties": {
        "value": {
          "type": [
            "number",
            "null"
          ],
          "minimum": 0,
          "maximum": 1
        },
        "src": {
          "$ref": "#/$defs/source"
        }
      }
    },
    "path": {
      "type": "string",
      "minLength": 1,
      "pattern": "^(?![/\\\\~])(?![A-Za-z]:)(?!(.*/)?\\.\\.(/|$))"
    },
    "scan": {
      "type": "object",
      "required": [
        "commit",
        "branch",
        "at"
      ],
      "properties": {
        "commit": {
          "type": [
            "string",
            "null"
          ]
        },
        "branch": {
          "type": [
            "string",
            "null"
          ]
        },
        "at": {
          "type": "string"
        },
        "recorded": {
          "type": "boolean"
        },
        "detached": {
          "type": [
            "boolean",
            "null"
          ]
        },
        "dirty": {
          "type": [
            "boolean",
            "null"
          ]
        }
      }
    }
  }
}
