{"contract":1,"files":{"src":"dossier.json#coverage.source_files","unit":"count","value":6},"languages":[{"files":6,"name":"Python","share":1.0}],"lines":{"src":"facts/metrics.json#metric[scope=file].value.lines","unit":"lines","value":19},"schema_version":1,"stages":[{"id":"facts","state":"done","title":"facts"},{"id":"engines","state":"partial","title":"engines"},{"id":"features","state":"done","title":"features"},{"id":"policy","state":"partial","title":"policy"},{"id":"rules","state":"partial","title":"rules"},{"id":"roles","state":"partial","title":"roles"},{"id":"intake","state":"done","title":"intake"},{"id":"setup","state":"partial","title":"setup"},{"id":"verify","state":"partial","title":"verify"},{"id":"session","state":"partial","title":"session"},{"id":"measure","state":"done","title":"measure"},{"id":"crawl","state":"partial","title":"crawl"},{"id":"layers","state":"done","title":"layers"},{"id":"architecture","state":"partial","title":"architecture"},{"id":"lock","state":"done","title":"lock"},{"id":"record","state":"partial","title":"record"},{"id":"journeys","state":"partial","title":"journeys"},{"id":"screens","state":"partial","title":"screens"},{"id":"baseline","state":"partial","title":"baseline"},{"id":"keeping","state":"partial","title":"keeping"},{"id":"visual","state":"partial","title":"visual"},{"id":"load","state":"done","title":"load"},{"id":"layers_trial","state":"skipped","title":"layers_trial"},{"id":"experience","state":"skipped","title":"experience"},{"id":"readiness","state":"done","title":"readiness"},{"id":"claims","state":"done","title":"claims"},{"id":"probe","state":"done","title":"probe"},{"id":"sustainability","state":"done","title":"sustainability"},{"id":"transform","state":"done","title":"transform"},{"id":"semantic","state":"partial","title":"semantic"},{"id":"plan","state":"done","title":"plan"},{"id":"target","state":"done","title":"target"},{"id":"proposals","state":"partial","title":"proposals"},{"id":"triage","state":"partial","title":"triage"},{"id":"cards","state":"done","title":"cards"},{"id":"ideal","state":"partial","title":"ideal"},{"id":"pipeline_gaps","state":"partial","title":"pipeline_gaps"},{"id":"reconcile","state":"done","title":"reconcile"},{"id":"order","state":"partial","title":"order"},{"id":"steps","state":"done","title":"steps"},{"id":"reports","state":"done","title":"reports"},{"id":"translate","state":"partial","title":"translate"}]}